{
  "formula_strategy": {
    "risk_annotations": [
      "ChatGPT web smoke package does not execute write tools before user confirmation."
    ],
    "summary": "원본 데이터를 AI가 직접 계산하지 않고, 새 시트의 수식과 원본 참조로 결과표를 채운다."
  },
  "intent_ref": "/Users/kangmin/Documents/excel-workbook-editing/review-packages/spreadsheet-table-builder/chatgpt-web-smoke/2026-06-08/chatgpt-web-smoke-1a23e444/table-builder-ui/2026-06-08/table-builder-preview-chatgpt-web-smoke-spreadsheet-Raw/manifest.json",
  "interpreted_output_shape": {
    "columns": [
      "2026-01",
      "2026-02"
    ],
    "measure": "사용자 프롬프트에 설명된 집계값",
    "rows": [
      "Team A",
      "Team B"
    ]
  },
  "plan_kind": "table_build_plan_v1",
  "rollback_plan": {
    "kind": "delete_created_sheet"
  },
  "schema_version": "1.0",
  "source_evidence_needed": [
    {
      "purpose": "사용자가 스케치한 결과표를 기존 데이터와 수식/참조만으로 구성할 수 있는지 확인",
      "range": "'Raw'!A1:C4"
    }
  ],
  "target": {
    "artifact_type": "google_sheets",
    "creation_mode": "sheet",
    "sheet_title": "CHATGPT_WEB_SMOKE_TABLE"
  },
  "unresolved_questions": [],
  "validation_plan": {
    "credential_boundary": "Validation artifacts remain credential-free.",
    "readback": "After confirmation, read created sheet formulas and formatted values."
  }
}
